Work Item Type,Title,Description,Priority
User Story,"As a user, I want to view and modify items in my cart before checkout.","Show cart summary with thumbnails, titles, prices, quantity selectors, and subtotal. Allow removal of items.",1
User Story,"As a buyer, I want to complete my purchase using a credit card via Stripe.","Redirect to Stripe Checkout or embed Stripe Elements. Capture payment, confirm success/failure, and create order record.",1
User Story,"As a user, I want to see my order history after logging in.","Fetch and display list of previous orders with dates, totals, statuses, and links to view details.",3
User Story,"As an admin, I want to add a new product to the catalog.","Form with fields: name, description, price, category, image upload, stock quantity. Save to database and make visible on site.",2
User Story,"As an admin, I want to edit or delete existing products.","Provide table/list of products with Edit/Delete buttons. Confirm deletion and update visibility instantly.",2